author,date,review,score
장필규,2024년 4월 23일,이번 오버로드 콜라보하면서 배경음 버그가 심각함   방치 상태  로비 나오면 오버로드 오프닝 나오는데 이건 끄는 방법이 없음 음향조절에서 어떤 음향을 낮춰도 노래 소리는 그대로임  월광극장에서 잔비가 좌에 앉은거 배경화면인데 잔비가 아인즈된거 같음   파훼법  설령 로딩이 다끝나서 터치하면 시작하는 상태여도 누르지말고 아인즈 눈 번쩍하고 노래 시작되고    초 텀 두고 시작하면 정상적으로 로비가짐 ,2
옥시시 수염차,2023년 12월 11일,몇년 째 하고있는 유일한 게임입니다  그만큼 편의성도 개선되고 좋지만 특히 배속부분도 우와  할만큼이 아니라  드디어 됐네  이런 느낌이에요  컷씬은 에픽세븐만의 매력이라고 느껴서 배속포함이 아닌건 이해하지만 차라리  배속도 있었다면 어땠을까    하네요  또 특히나 제일 벽느끼는 그놈의 장비 토벌   다른건 스킵기능이 없어도 되니깐 특히 뉴비들은 장비도 없어서 와이번   단 오토덱 만드는 것도 힘들어보입니다  오토덱 만들어서 도는 사람들도 말이 많은데 토벌만이라도 스킵기능 만들어주면 좋을 거 같습니다  그래야 장피 피밍이라도 삘리 하면서 장시간 멈춰있던 다른 컨텐츠들도 뉴비들이 좀 더 빠르게 진행 할 수 있지 않을까 합니다   제발요    ,5
석이,2024년 1월 18일,게임에 목숨걸고 하는 스타일은 아니지만 제 개인적인 생각과 지금 에픽세븐의 뉴비 입성은 많이 힘들다고 봅니다 그렇다고 바로육성을 할수있는것도 아니고 다알고있으시다고 봐요   이런점 다떠나서 전 그냥 수집 위주로하다가 템좋은거나오면 한번씩 하고 편하게 하고있어요 게임을 하지만 다른 유저분들은 아니겠죠 오래오래더 하고싶어요 그러기위해선 뭔가 띵한 부분이 있어서 새로 유입도 많이 들어오시고 매출도 늘어야 유지가된다고봐요 더새롭고 재미있는컨텐츠 기대합니다 운영해주셔서 감사해요,3
우정,2022년 11월 18일,그오 퍼블리싱 최고입니다  방송도 하고  공지사항도 댓글창이 열려서 의견을 개진할 수 있습니다  소통하려는 것도 보이고 개인적으로는 그 이후로 나아졌다고 느낍니다  페그오 자체의 문제는 한 두 개가 아니지만      과금패스 없고  레벨업 패키지 없고  성정석 원툴 노가다 게임인거 나름 나쁘지 않다고 생각합니다  과금유도 자체는 많이 없어요  다만 애정캐를 뽑으려고 가챠를 돌리면 놀랍게도 천장이 없다는게 문제지만요  스토리 나름 이정도로 신경써주고 진심  부  장   장이 좀 폭탄이지만  캐릭터 매력을 서사로 신경써줘서 나쁘진 않아요  물론 그걸 뛰어넘는 저열한 게임성과 편의성 등등등등  단점은 많습니다 ,5
Sone GG,2023년 12월 19일,   다른 계정으로 로그인할때마다 설정값  게임속도  아이콘 크기  보구연출 속도 설정 등 이 초기화되어 불편합니다  설정값을 기기에 저장하거나 계정에 연동시켜주셨으면 합니다    공지 팝업 외의 화면에 블루투스 마우스의 입력 인식이 되지 않아      삼성 덱스  모드에서 게임 플레이가 불가능한 수준입니다  마우스 입력 인식 가능하게 해주셨으면 합니다,4
알아서뭐하려구 (본계),2023년 2월 9일,무지성 무과금으로 게임해도 최신스토리는 물론 이벤트까지 못깨본적 없음 더군다나 미래시가 잘 잡혀있어 공략이 수없이 존재하는 만큼 깨는데 어렵지 않고 영주 시스템과 서포트 시스템이 잘 되어있어 무과금 낮은 스펙으로도 고스펙 게임친구 하나만 있으면 밀 수 있음  이벤트의 빈도가 높아 꾸준히만 한다면 재화 및 쓸만한 캐릭 예장을 얻기 어렵지 않음 얻기 힘들다는 사람들은 문제가 있는것 편의성 업데이트를 해주기 때문에 소소한 부분에서 편할 때가 많음 그러나 동시에 태블릿 혹은 최신기종 외에는 렉이 굉장히 심하다는 단점과 현 최고레벨    과 어펜드 스킬을 최고레벨 찍기 위해서는 과금이 필수라는 점이 가장 아쉬움 그렇지만 굳이 안찍어도 상관 없다는 점이 좋음  그러나 단연코 최고 단점은 이벤트스토리를 포함해 약    의 스토리는 심각할 정도로 재미없고 초반 성장이 느리며 게임이 돌아가는 방식에 대한 이해도가 필수적으로 필요하기 때문에 진입장벽이 매우 높은편인 점이 아쉬움,5
