recommendationid,steamid,num_games_owned,num_reviews,playtime_forever,playtime_last_two_weeks,playtime_at_review,last_played,language,review,timestamp_created,timestamp_updated,voted_up,votes_up,votes_funny,weighted_vote_score,comment_count,steam_purchase,received_for_free,written_during_early_access
105670222,76561198034771900,371,46,2985,0,1162,2024-01-27 11:35:03,english,"4/10 -- not very fun. \n\ngameplay: constantly grinding your agents' xp so that they don't suck is very tedious; if you use mods to try to eliminate this problem you'll quickly realize that the majority of the gameplay revolves around incrementing your employees' levels by clicking boxes that hover over bootleg scps. \n\nadditionally many abnormalities are not viable gameplay choices because they are poor at leveling the agents' skills: for example i wanted to pick warm-hearted woodsman but i already had an abnormality of the same class that trained my agents' temperance skill so there was no point in choosing it and i had to settle for a boring one.\n\nalso like most management games the goal is to 'do everything right' and successfully end the day with as few casualties as possible. it turns out that 'doing everything right' is extremely easy to figure out and do and what ends up happening is... well nothing. nothing happens. you click on boxes for the entire day and since you avoided the obvious pitfalls and ridiculous insta-kill conditions nothing happens. it's extremely dull and avoiding that blandness requires: a.) the player to intentionally make mistakes during gameplay or b.) the abnormalities chosen having unfair or ridiculous abilities that allow them to force a mistake to occur (i.e. queen of hatred becoming harder to contain because the player is playing too well; singing machine instantly killing an agent that is too fortuitous etc.)\n\nin short: \n- the most fundamental gameplay concept is grinding. if you do not find grinding fun then avoid this game.\n- accessing much of the game's content is discouraged because it doesn't aid the grinding process.\n- if you play the game competently nothing of note will occur; nothing special will happen outside of grinding.\n\nyawn-inducing.\n\n",2021-12-12 08:15:09,2021-12-12 08:15:09,False,1,2,0.425420641899108887,2,True,False,False
105567809,76561198348819457,429,50,80,0,80,2021-11-25 20:16:18,english,"this game is incredibly boring oh my god",2021-12-10 20:33:17,2021-12-12 11:45:04,False,1,2,0.472869515419006348,0,False,False,False
105060149,76561197970250774,0,43,256,0,256,2021-12-02 18:26:56,english,"obviously a lot of people love this and i enjoyed the principal and would like the developers to continue.\nwhat it comes down to is too much grinding then small mental slips spelling disaster (doesn't equal an end but it does mean spending too much time over again).\nif you have unlimited time and patience you'll hopefully love it.\nmy time is more valuable.",2021-12-02 18:33:17,2021-12-02 18:33:17,False,0,0,0.47826087474822998,0,True,False,False
104768759,76561198242832978,0,63,77,0,77,2021-11-30 08:25:20,english,"i can't actually agree with the most positive reviews.\nthe gameplay is really slow and after a short time it gets boring. so (1 - 2 hours)\nyou're just doing one simple thing in the whole game and have 1 dialogue after each day... that's it.\n\nthe only positive thing is the story.\ni think the actual trailer and description is a bit misleading",2021-11-30 08:34:54,2021-11-30 08:34:54,False,4,0,0.471039831638336182,0,False,False,False
103597709,76561198321817125,0,105,155,0,155,2021-11-09 16:42:34,english,"pretty difficult for such a simple looking game. got a little boring after 2 hours",2021-11-25 09:40:09,2021-11-25 09:40:09,False,0,0,0.454545468091964722,0,True,False,False
103503317,76561198089073055,411,64,496,0,496,2020-05-13 11:26:39,english,"i have always wanted to play a management simulator set in the scp universe and i thought this would do. but unfortunately the game gets very repetitive fairly quickly making the game feel like a grind. \n\ni have never seen a game that is so hard to learn yet easy to master. the hardest obstacle to overcome in this game is how terrible the learning curve is once you get over that you have pretty much already mastered the game and now it just becomes a slow multi-hour grind to the end.\n\n",2021-11-25 05:29:25,2021-11-25 05:29:25,False,2,0,0.488612830638885498,0,True,False,False
103492275,76561198976200107,0,6,13078,0,8430,2024-02-20 07:50:37,english,"banger game but its a shame kjh hates women",2021-11-25 05:10:38,2024-01-14 02:21:11,False,0,0,0.523809552192687988,0,True,False,False
103468640,76561197993407356,0,144,8,0,8,2021-11-25 04:33:29,english,"a confusing mess of terminology and numbers that i ultimately found boring in the first five minutes.\n",2021-11-25 04:34:22,2021-11-25 04:34:22,False,1,2,0.406929075717926025,0,True,False,False
103170094,76561199075084644,0,11,16821,0,16821,2023-11-20 13:10:36,english,"please don't play the game trust me it isn't worth it. runia is so much better just watch a summary.",2021-11-21 08:13:16,2024-04-07 04:51:40,False,0,0,0.545454561710357666,1,True,False,False
102693245,76561198043665852,0,24,7660,0,7660,2021-11-13 14:30:40,english,"story is really good but the gameplay is extremely repetitive and slow.",2021-11-13 16:08:00,2021-11-13 16:08:00,False,35,8,0.564975857734680176,0,True,False,False
102686586,76561198018810478,0,16,236,0,236,2021-11-01 05:47:49,english,"i wanted to like this one but the gameplay didn't work for me. things that feel like basic gameplay mechanics (like being able to see character health without which your agents appear to die at random) are gated behind unlocks that can take hours to reach. learning more about the abominations is interesting and presumably the story was going somewhere but the basic gameplay loop just isn't fun. its attempt to include roguelite permadeath mechanics is so un-fun that it seems to recognize this and defaults to giving you the option to restart days or revert to a save point... but doing that is almost more punishment than trying to limp along with nearly no agents left because the only real point of interest in a day is learning more about the abominations which you've already done if you're repeating a day. there's no new interesting information just a grind where you see what you've already seen before.\n\nthis is before you get into the random event mechanics that unavoidably flood your base with monsters. i got through 4 or 5 days of this mechanic before realizing the entire game was going to be a series of just getting all my guys murdered and either slogging through re-doing the same stuff or trying and failing to work my way back up. i give up. if i have any further interest in seeing where the game goes i'll just look up a playthrough so i can skip all the grinding.",2021-11-13 13:07:52,2021-11-13 13:07:52,False,6,0,0.546962857246398926,0,True,False,False
102599146,76561198048846644,230,30,10524,0,6554,2023-03-04 14:05:19,english,"i do not recommend this game for those cannot accept death as daily routine.",2021-11-12 01:59:28,2021-11-12 01:59:28,False,7,6,0.549538016319274902,1,True,False,False
102529001,76561198087373972,0,5,5964,0,5941,2022-06-18 23:11:49,english,"this game literally ruined my life. oh gods. do not play lobotomy corporation. i haven't gotten a single ending yet save yourselves. also angela did nothing wrong and ayin can suck a fat dick",2021-11-10 18:36:20,2021-11-10 18:36:20,False,1,0,0.490066230297088623,0,True,False,False
102346362,76561198043856812,0,26,2250,0,2250,2021-11-07 05:32:39,english,"too much grind.\nbad ui.\n\ngame has gameplay for 20 hours.",2021-11-07 06:30:46,2021-11-07 07:37:34,False,4,2,0.493844002485275269,0,True,False,False
102286247,76561198891103138,673,228,43,0,43,2021-11-04 08:37:35,english,"after 1 hour and playing the tutorial i still had only a vague clue on what i'm doing there. the game doesn't offer achievements which is a huge turn off for me. but not only this it's very boring and not much is happening the controls are not always working and somehow all my characters always murder each other without me being able to stop this. can't recommend to play without looking things up since i'm not into opening wiki and looking for walkthroughs i had to refund it.",2021-11-06 07:23:45,2021-11-06 07:23:45,False,1,0,0.490066230297088623,0,True,False,False
102211996,76561198013903784,0,130,230,0,230,2020-04-02 00:15:15,english,"[h1]meet the game that sparked my love for the scp community[/h1]\n\n[h2]but disappointed me too[/h2]\n\n\n+unique art style\n+fascinating concept\n+promises challenge\n+dark atmosphere\n-mind numbing gameplay loop\n-terrible english translation\n-very little management\n-challenge may only be present in later stages getting there is a chore.",2021-11-05 00:47:10,2021-11-05 00:47:10,False,3,0,0.524126410484313965,0,True,False,False
102105879,76561198267206919,0,147,972,0,760,2022-03-13 08:45:41,english,"garbage",2021-11-03 03:31:05,2021-11-05 09:03:15,False,1,2,0.417655736207962036,0,True,False,False
101984943,76561198001731136,0,5,80,0,80,2021-11-01 04:27:44,english,"too wordy too boring too expensive. i cant understand why it has good reviews they must be hacked or something",2021-11-01 04:29:03,2021-11-01 04:29:03,False,1,1,0.33264729380607605,0,True,False,False
101859127,76561198011858886,0,78,13,0,13,2021-07-07 00:31:35,english,"convoluted and boring . needed a refund",2021-10-30 13:18:26,2021-10-30 13:18:26,False,0,0,0.339884430170059204,0,True,False,False
101833259,76561198110074010,656,21,235,0,235,2021-10-30 03:43:10,english,"i was expecting more from game with 94% positive reviews.  i like the concept it is very original however the game feels very unpolished to me + possibly targeted to audience with different taste.\n\nhere is the list of things which annoy me too much to prevent me from enjoying the game further and deeper:\n- it sometimes crashes to win10\n- you cannot see hp and sp (hit points and sanity points) of your employees unless you're assigning them to work from room menu\n- visual novel style between days/missions - to my taste they talk too much about nothing - could be good for those with same taste as authors for me it was neither interesting nor funny\n- too much text anywhere on screen which quickly pops up and some of it dissapears too quickly to dissapear - it's more confusing than interesting or fun to read\n- weird and very long tutorial - reading manual (f1) was quicker and more informative that one was good\n- day time not limited - it feels weird that you can complete a day within a minute or grind for hours in one day..\n- weird music which wore me down i had to mute it\n- when zoomeed out names and quotes from employees are so small that you cannot read them\n- also font size being scaled differently in different rooms screens and zooms is weird and hurts the readability more than it helps it..\n- weird ui unintuitive but possibly you can get used to it\n- bad overview of your employees as zoomed out you cannot read their names well or see them well.. you also cannot see their list to have good overview who's hurt or so..\n\nthese things can be okay to people with different taste than i do so i am not saying it is a bad game. i just strongly do not recommend it to those with similar taste i have.",2021-10-30 03:58:34,2021-10-30 03:58:34,False,5,1,0.463228106498718262,0,True,False,False
101794467,76561198184653439,757,2,2590,0,2588,2022-08-26 23:22:44,english,"game crash under certain condition sent email to project moon and got no response",2021-10-29 14:10:46,2021-10-29 14:10:46,False,1,0,0.451410681009292603,0,True,False,False
101653347,76561198012570292,0,37,1334,0,1444,2021-08-01 16:37:13,english,"not based",2021-10-26 17:47:29,2021-10-26 17:47:29,False,1,0,0.342472344636917114,0,True,False,False
100529827,76561198160133974,161,23,4660,0,3423,2022-11-20 19:44:06,english,"unfortunately in the past few months as of editing this review it's become clear that the director of the company that made this game is awful to work for and has done some truly reprehensible things to his employees. i can't support spending any money on these games anymore. sorry.",2021-10-05 09:38:41,2023-09-19 09:54:10,False,0,0,0,0,True,False,False
100038483,76561197972403229,885,53,104,0,104,2021-07-07 03:10:25,english,"i wanna get lobotomy after playing this game",2021-09-27 21:51:50,2021-09-27 21:51:50,False,6,8,0.490786612033843994,0,True,False,False
100028525,76561197970527351,371,37,201,0,189,2021-10-10 03:25:38,english,"not the scp game i wanted.\n\nit's not often i get a few hours into the game and really feel like i have zero understanding of how it works or what i'm doing. not sure if it's a bad translation or an over-dependence on kabbalahic terminology or what. it's basically stuff happens: the game.\n\ni get the general gist; the not-foundation is juicing monsters for energy. i have four different tasks that can be done to them you eventually learn more and a variety of gear i can acquire after studying them for a bit.\n\nbeyond that no clue what the hell is going on. send a guy to do a task that should be easy he goes insane the ai whines that i'm not paying attention to my staff...i have no control over the process once they go in the chamber i can't abort or something. there's no staff list so i can check all my guys at a glance. there's a dozen things happening while a bunch of my minions are standing around doing nothing and the game decides i'm failing.\n\ni barely get the whole meltdown mechanic and what i'm supposed to do to counter it.\n\npeople go nuts or berserk after failing to handle a critter; they proceed to run rampant across the base attacking and stressing everyone else out. i have the power to send agents to stop them and they can't; save for a single firearm at the moment they have to slowly swing melee weapons at the problem staff. which means everyone goes nuts watching a dude panic while a parade attacks the space he left five seconds before.\n\nnow i have random bug assaults attacking the base completely unrelated to any creature under my control.\n\ni don't get why having an information team gets a second class of monsters only they can babysit. shouldn't they be the ones doing the research or something? it feels like i'm playing x-com and my scientists are in the field shooting at aliens.\n\ni want to love it. especially the evangelion-esqe terminology and flashing warnings. but i'm not liking how it plays at all. it feels like it might as well not be in english and that using the wiki is a requirement. it feels like a puzzle game that aggressively punishes you for not knowing the solution rather than something i understand mechanically and am improving at. will futz with it some more but it's not been an enjoyable experience.",2021-09-27 15:21:58,2021-09-27 15:21:58,False,6,1,0.478017330169677734,0,False,False,False
99175836,76561198006981447,0,9,6836,0,2614,2021-09-21 02:25:25,english,"fuck the don't touch me abnormality.\n\nthis game in general just goes too much into being frustrating. often there are abnormalities where few seconds of not paying attention will cost you entire in-game day (which can sometimes take even 40 minutes) of work.\n\nit's really a shame because otherwise it's an amazing experience. but it wasted so much of my time by dumb shit requiring resetting whole day that often included time-consuming ordeals to deal with.\n\nfuck that aspect this game does not respect your time at all.\n\nbesides that it's a great game but because of that i can't really recommend it. big chunk of my play-time is wasted time.",2021-09-12 01:49:23,2021-09-12 01:51:17,False,1,0,0.486733794212341309,1,False,False,False
99057312,76561197970406584,908,303,157,0,157,2021-09-09 22:15:27,english,"lobotomy corporation is one of those games that give you high lethality deeply founded on randomness like it's a feature people will enjoy rather than something that will make people quickload every five minutes. no one has yet seemed to figure out that combining this with rpg mechanics means no one will be stupid enough to choose to lose their upgraded agents when the quickload button is right there.\n\nthe unfun lethality is further exacerbated by the fact that your initial interactions with all anomalies will be entirely a random gamble since there won't even be hints about what's effective or what makes them kill people. so every time you fire up a day the first thing you'll probably do is bounce everyone off the new anomaly until they die to unlock some info about it. then reload the day and use the ooc knowledge from the day before to perfectly exploit said anomaly.\n\non top of that the ui is kind of a cluttered mess and some extremely basic shit like being able to see your agents' health bars or accelerating time are unlocked abilities. i have no idea what that's supposed to contribute to the game except annoying me the player.\n\ni would possibly also be more invested if the between-missions writing wasn't... i don't think i can even call it bad it's just really generic motivates me not at all.\n\nthe writing for the individual anomalies is nice though generally the art works well and the soundtrack is really atmospheric. \n\ni would skip this game personally.",2021-09-10 01:43:48,2021-09-10 01:43:48,False,0,1,0.348763763904571533,0,True,False,False
98615463,76561198007174354,568,126,116,0,116,2021-09-01 22:51:00,english,"it's... not fun.\n\nyou do barely anything just send people into rooms with no knowledge of anything wait for the result to come out and then do it again.\n\nyou do that day after day learning a bit on how things work - but not that much - and you keep clicking once in a while to send people to rooms.\n\nit's boring.\nmaybe i'm missing something but it's not interesting. i think it got the success it has because of the nuscp-reddit-maymay thing but as a game in itself it's not fun.",2021-09-01 22:58:25,2021-09-01 22:58:25,False,1,0,0.420622795820236206,1,False,False,False
98583431,76561198030893104,0,234,150,0,132,2021-09-01 06:26:15,english,"interesting idea to research monsters and the like.  my guys for some reason keeps either going insane or die in the hallway outside of the containment unit.  unfortunately i have no idea how to handle this situation as the tutorial didn't go over this and it sucks to keep retrying day after day and just wondering if i'm playing this game correctly.",2021-09-01 06:18:02,2021-09-01 06:18:02,False,0,0,0.458015263080596924,0,True,False,False
98502913,76561198087840341,408,28,2459,0,1453,2023-02-18 00:19:30,english,"this game is in a really weird spot for me. aesthetic and story wise i absolutely love the game but everything else about the game is incredibly taxing to do. if you are a perfectionist like me you will have to restart every day several times to have the perfect outcome you want. \n\nthe game even though is great is concept really lacks mechanics wise so many things you should be able to easily do is provided to you in extremely runabout ways for example your employees are subjugating an anomaly they will just stand inside one another with no way of being able to see their health or sanity so you cannot pull them back the only way to do this is to click on an anomaly and open up a sub menu that can only display around 5 employee's status at once if you have employees from different departments fighting one anomaly you will constantly need to pause the game scroll in the sub menu to different departments and view their stats individually. this game could be so much more but feels very unpolished due to inconveniences like this that make the gameplay extremely taxing to do at middle stages of the game depending on your luck the game turns into a micro management simulation that will absolutely suck the fun out of it.\n\nthe game is so simple but barely provides you the tools to deal with most of the inconveniences that should be fixed in a single click. due to the unpolished gameplay that you can't really even fix with mods i cannot recommend you this game it is very taxing and depleting to play and essentially turns into a monitor x anomaly every y second to make sure they don't do z.",2021-08-30 20:47:31,2021-08-30 20:47:31,False,0,1,0,1,True,False,False
98389459,76561198000711404,676,89,5,0,5,2021-08-29 00:27:47,english,"please rework your tutorial. it's a mess of text walls",2021-08-29 00:29:46,2021-08-29 00:29:46,False,1,1,0.470567226409912109,0,False,False,False
98286221,76561199023731878,0,2,301,0,231,2023-08-25 21:38:41,english,"amazing game i love it. has an amazing soundtrack.",2021-08-27 06:11:10,2021-08-27 06:11:10,False,0,1,0.425565421581268311,0,True,False,False
