recommendationid,steamid,num_games_owned,num_reviews,playtime_forever,playtime_last_two_weeks,playtime_at_review,last_played,language,review,timestamp_created,timestamp_updated,voted_up,votes_up,votes_funny,weighted_vote_score,comment_count,steam_purchase,received_for_free,written_during_early_access
135990265,76561197965979524,0,41,3597,0,3029,2023-04-04 10:08:16,english,"it's a good game i just...can't deal with how much progress you lose sometimes. losing all of your gear because you pressed the do not touch button is just...awful. i spent many hours for all that gear and it's just gone at literally the click of a button and rewinding to the repository doesn't actually bring it back. i can't recommend any game that will wipe out so much progress and there's nothing you can do.",2023-04-03 06:59:59,2023-04-03 06:59:59,False,2,1,0.496594935655593872,0,True,False,False
135845394,76561198211901280,0,7,109,0,109,2023-04-01 11:10:17,english,"lore's cool concept's great but gameplay is an impressive mixture of incredibly boring and insufferably annoying",2023-04-01 11:11:40,2023-04-01 11:11:40,False,1,0,0.470971733331680298,0,True,False,False
135657877,76561197998984845,0,13,285,0,91,2023-03-29 20:26:11,english,"your only saving grace is that you don't actually need to play this game. just look at the cutscenes so you know what's going on for the gacha game. that's the only reason why people suddenly care about this game 5 years later right?",2023-03-29 15:11:11,2023-03-29 15:11:11,False,0,0,0.377245515584945679,0,True,False,False
135432428,76561197972546552,862,37,105,0,105,2023-03-26 04:53:20,english,"by far the worst game i've ever played with an attractive steam review score.  less depth than skyrim and mind numbingly boring and grindy.  i'm all for unique and experimental games but that's reserved for games that have more going on than your average mobile game.",2023-03-26 08:23:49,2023-03-26 08:23:49,False,1,0,0.393437057733535767,0,False,False,False
135285125,76561198084816492,107,24,13695,0,1064,2023-10-29 00:03:11,english,"i like the game it's concept and it's somewhat janky gameplay. the killer is the lag. it kicks in around the halfway mark in-game and it never goes away. mods do not fix this. i cannot in good faith recommend playing unless you have immense faith in your pc powering through. the game is more valuable for it's story than anything so perhaps getting the game experience second person through videos would be better or modding the game to skip game progression so you can get to the story. it sucks it has to be this way but it is seriously unbearable especially when compounded with how brutal the difficulty already is without it.",2023-03-24 14:52:22,2023-11-08 20:07:25,False,0,0,0,0,True,False,False
135129197,76561197972403463,0,15,106,0,106,2023-03-03 09:20:55,english,"text is so small it's unreadable. no option to customize.\n\nkind of hard to play if you can't read the tutorial.",2023-03-22 08:07:41,2023-03-22 08:07:41,False,0,0,0.487616091966629028,0,True,False,False
134944627,76561198440668144,130,6,3510,0,1504,2024-03-26 13:40:50,english,"there is not a single gameplay element that i enjoy here",2023-03-19 15:29:02,2023-03-19 15:29:02,False,2,2,0.413564056158065796,0,True,False,False
134928739,76561198007558399,0,63,12,0,12,2023-03-19 09:44:01,english,"feels like flash game from kong or ng. a shitty one.\n\ni don't even have anything to say because i just got entirely fed up with the non-sense translation and idiotic tutorial.",2023-03-19 09:47:17,2023-03-19 09:47:30,False,0,1,0.427371501922607422,0,True,False,False
134674874,76561198012068261,238,13,14,0,13,2023-07-01 01:21:36,english,"there may be a great game here but if there is it's buried behind interminable dialog screens.",2023-03-15 08:00:45,2023-03-15 08:00:45,False,0,0,0.422418713569641113,0,True,False,False
134275429,76561197974382083,611,11,50,0,50,2023-03-08 03:17:22,english,"this game doesn't launch with citrix workspace installed on your computer. fyi.",2023-03-08 12:19:09,2023-03-08 12:19:09,False,0,0,0.455770641565322876,0,False,False,False
134097837,76561199061564251,79,5,9346,0,8499,2024-03-30 09:12:33,english,"lore's awesome gameplay's a snoozefest",2023-03-05 14:41:37,2023-03-12 13:37:09,False,15,0,0.59382927417755127,0,True,False,False
133656827,76561198006694956,0,134,624,0,624,2023-02-26 19:25:30,english,"it is exactly as grindy as the reviews say. and the controls are clunky. which combined with constant micromanagement becomes a real pain.\n\nit is also exactly as unique as the reviews say sooo... if you're not one to be scared away by a game that is actively trying your patience this is the game for you.",2023-02-26 20:10:39,2023-02-26 20:10:39,False,3,0,0.528145730495452881,0,True,False,False
133452417,76561198042643953,0,75,8332,0,8332,2023-02-24 08:06:41,english,"i have a lot of respect for the people who made this game and i'll more than happily play their other products but i just had too many problems build up as i went through the game but incase you do get the game my best advice to give would be this.\n\ndon't be afraid of replaying/restarting even from day 1.\nthe games expects you to use memory repository and the only thing you will lose from going back even to day 1 are the employees that you hired and the abnormalities you obtained.\nhowever any items and/or information you obtained from those abnormalities is kept.\nmission progress/completion is also kept even from day 1 resets this makes replaying the game significantly easier so do not be afraid of this or losing employees.\n\nwith that said i actually have a fair amount of nice things to say about the game so let's start off with the\n\n+++positives+++\n\nthe thematics of the game are great!\ni thought the general aesthetic worked really well both for budget reasons and as an intentional style.\nbut beyond graphics there's a lot of horror vibes the store description doesn't lie with what it's inspired by i really liked the scp vibes throughout.\n\nspeaking of scp's the abnormalities are numerous and varied i loved how different a lot of them were and it was surprisingly satisfying figuring out how to manage them all and in the end profit off them.\n\nthe story was also pretty neat though i can't go into depth about it.\ni found my eyes glazing over it a smidge with how it was worded at points but overall i liked how dark it was throughout and how things played out with all of the characters.\n\nlastly the music was also pretty cool at points.\nfor the most part it was kinda samey unless things were going wrong but when things were going wrong it got pretty good.\n\nnow onto the \n\n---negatives---\n\nthe games performance is terrible specifically as you progress.\nwhat started out perfectly smooth devolved into low framerates as the facility expanded to the point where even loading screens came close to crashing the game if i clicked or alt tabbed.\nthis is a problem when you're faced with combat because when particle effects happen the game practically freezes momentarily but everything is combat has particle effects.\ndamage prompts insanity prompts blood splatters everything will cause lag if you use large groups.\nnow while small groups have their benefits being discouraged from using a large group because the games performance will just die along with all my lower level employees feels terrible.\nbut even outside of combat scrolling across the facility is laggy animations get less smooth and for the late game objectives specifically it just feels awful.\n\nto go more in-depth on combat it's really simple. you select employees and you can tell them to either go to a location or attack something and later on in the game you get bullets which let you manually target people to give them shields health sanity or just kill them if they start to become troublesome.\nbut my problem with combat is that it's too simple i cannot tell an employee where specifically i want them in a room i can only tell them i want them in that room. so when i'm fighting an enemy and i want to move them to the other side of said enemy i have to select the employee tell them to go into a room on the other side of the enemy (assuming there even is one otherwise their only option is to either get hit or leave the room entirely) wait for the employee to move select them again and tell them to attack the enemy.\nit's tedious it's clunky and it's one of the reasons i disliked when the game decided to delve more into combat specifically.\n\nspeaking of those objectives from earlier throughout the entire game you're given missions from different people in the facility culminating in a final objective from them. these started off perfectly fine but the last few in particular were just awful.\ni will spoil three of these in particular but these are not major plot spoilers just gameplay ones.\n[spoiler]starting with the disciplinary team i don't understand why they had boss fights be the days objective instead of just collecting energy the game is not built for boss fights as it just devolves into kiting attacks over and over even with your best units. but for your units which aren't the best you just kinda have them on the side lest they die and ruin everyone elses sanity.\nit's a boring fight which you cheese either via kiting or through some other method such as unleashing abnormalities to the work for you which sounds like a smart use of mechanics but it's pretty dull [/spoiler]\n\n[spoiler]next is the record team this one is just dull. it takes away your ability to pause and manage things (to an extent) but it also removes your ability to speed things up opting to speed things up gradually as the day goes along. i find this extremely boring as most abnormalities don't use time as a mechanic so it just makes the day go extremely slowly and if you need to restart you'll feel every second crawl on by. [/spoiler]\n\n[spoiler]finally we have the extraction team another mission that requires you to finish a boss fight instead of getting enough energy so what this means is more kiting to avoid attacks. the gimmick with this boss is cool you cannot hurt the boss until you deal with specific abnormalities that get put into a meltdown state.\nonce they're vulnerable you have a good chunk of time to wail on them. there are several problems here. she can place her meltdown effect on abnormalities which are already on cooldown meaning you need to wait unnecessarily before you can send someone to deal with it and when the boss becomes vulnerable they stop for a long while even if they're in a doorway transition where you cannot reach their model. if you do not deal with them in this state there is a good chance they'll throw out more meltdowns again all because you literally could not reach them because the game didn't allow you to.[/spoiler]\n\nand going back to general gameplay i really wish the game had more automation.\na lot of days i was just going through the motions it would've been nice if there was some way i could just automatically send people to go do the jobs i would like them to do. replaying days felt boring because very little changed and as the facility expanded the fatigue really set in.\n\nand speaking of the facility i mentioned how i loved the variety of abnormalities earlier but sometimes the game can give you some abnormalities you're just not able to deal with at points.\nsome will get out because you have too many clerk casualties one will get out because you don't have enough clerk casualties some will get out because your employees are too underleveled or undergeared and in the worst case scenario you're getting them on days where a checkpoint is set and going back to said checkpoint fixes nothing. going back isn't bad but the reason for it can definitely feel bad.\n\n>>conclusion<<\noverall there was a lot i like about the game and it started off real strong but it just became so tedious and annoying with what i wanted from me later on.\nit's not devoid of quality and it definitely appeals to some people but i find that it was more annoying than anything else in the later game for me to recommend this personally.",2023-02-24 09:00:06,2023-02-24 09:00:06,False,157,4,0.860116958618164063,11,True,False,False
133345698,76561198035730464,0,12,463,0,463,2020-12-18 08:49:40,english,"not all games need to be fun. they do however need to respect my time and lobotomy corp absolutely does not. the game isn't difficult in the traditional sense; it's outright hostile to the player. it will lie to you it will cheat you and things will happen that you cannot predict or stop. maybe all of this is in service of a larger artistic point however as i stated before games need to respect my time if i'm to recommend them.\nread a wiki for the overly-complex and convoluted story and play library of ruina instead.",2023-02-22 15:54:00,2023-02-22 15:54:00,False,1,0,0.432624101638793945,0,True,False,False
133023120,76561198010521711,0,19,13426,0,3029,2023-03-26 11:31:12,english,"i can't recommend this game for many many small reasons that add up to it just not being an enjoyable experience.\n\n1. the game is time consuming. most of that time is spent watching meters fill up. it's monotonous and dull.\n2. the controls are a bit wonky. you can just tell this was not quality development because it really doesn't handle well. nothing feels fluid. you have to clunkily select and hand out orders. so much of the time you'll find yourself frustrated that you can't see various ui elements during combat or the ability to view your own units' stats in various parts is kinda crappy or the way you can't select multiple units with shift clicking how you'd want to. no hotkeys for almost anything. it's just very clunky and slow you can't move your agents to specific spots in a room you have to repeatedly tell them to move back and forth to get them to stand where you want them to. it's annoying and just badly designed.\n3. this game loves wasting your time with random events(doing the wrong thing with a monster/abnormality a semi-random ordeal event) that obliterate the majority of your agents and usually force you to start over. you'll know what not to do next time you play the level but this game has the formula of forcing you to die basically and then just expecting you to avoid it next time. rarely does it telegraph these things so the player can avoid it with skill. just trial and error game overs.\n4. ui text is tiny and there's no real option to make it bigger. it's fine during story segments but it's downright unreadable during status screens or gameplay portions.\n5. game is just littered with poor design choices. the equipment screen is clunky. ui is clunky. some abnormalities really feel badly designed. the combat is clunky and more difficult to control than it should be.\n\npeople insist that the story is incredible and perhaps it will end up that way. i'm on i think day 30 and there's nothing all that interesting so far. the writing for the abnormalities themselves are pretty basic and unless you're a really big occult fan or something they don't really do anything for me.\n\nso in short i can't really recommend this game because i don't think the average person would actually like it. it seems to be intended for a weird niche of gamers who want a challenge but one that isn't particularly rooted in skill-based gameplay with good controls but rather just trial and error sucking up a ton of time watching meters fill and remembering what things not to do and not doing them through a clunky interface. i want to like this game more but it's really not that good.\n\nedit: to add onto this i also have to note that this game has a gamebreaking memory leak. the longer you play the closer you get to a crash. part of why i stopped playing this game is that i was mostly through a very difficult midnight ordeal that i had carefully played through only to have the game just crash on me and completely wipe out an hour long session. then i went to do it again and...it happened again. absolutely unacceptable for a game that asks for this much meticulous play and time from you for a level to have a crashing problem like this if a level takes 45m-1h for you to finish.",2023-02-17 19:52:38,2023-03-06 21:24:55,False,2,2,0.483829230070114136,0,True,False,False
132287694,76561198080279857,0,141,216,0,216,2020-06-13 01:43:50,english,"steam's user reviews are an incredibly useful metric for gauging game quality. they're rarely far off the mark relative to the game's actual quality. which is what makes lobotomy corporation so interesting; it holds a 94% positive ratio and yet i cannot for the life of me understand why. there is nothing about the game that is at all conducive to a fun experience; if anything it is explicitly painstakingly designed to waste your fucking time. made it through this agonizingly long day after tinkering around with that innocuous new thing you got and learned some of the rules of? oh wait after the end of the day it just fucking kills your mook. whoopsie! better restart if you don't wanna make what's yet to come even more painful! oops forgot one obscure rule of how a baddie works and now your team that otherwise passes the gear check gets wiped out? restart!\n\nand that's the entire loop. there's no relief to any of it. you play the same days over and over again so as not to trip over the tiny roots that made you fall neck-first last time and all that awaits is more of the same except there's now even more esoteric rules piled on top that you haven't deciphered yet without restarting the cycle of endless save scumming. it's a dreadful unforgivable lack of respect for the player's time. and being a roguelite (i.e an almost universally terrible genre) you're expected to repeat this fucking torture multiple times. where is the fun in any of that? suffering is fun when you know there's a light at the end of that tunnel. lobotomy corp doesn't have a light at the end of that tunnel it's just an endless fucking tunnel. there must be a massive audience of people who have given up any and all respect they have for their own time because a game that in no aspect exceeds a 4/10 should not be sitting at a 94% positive review score.",2023-02-06 06:57:52,2023-02-06 06:57:52,False,3,1,0.430799424648284912,10,True,False,False
132092656,76561198055635166,0,26,668,0,298,2023-05-30 00:39:59,english,"i got through the first 2&1/2 out of it looks like 7 departments and ultimately had to conclude seeing the rest of the game wasn't worth it. \ntedium would be how i describe playing this game. its a clickfest that builds upon itself with little evolution. the departments i unlocked didn't do anything meaningfully different from each other and even categorizing them by departments is misleading because its one continuous facility and the game /tells/ you a lot about how the yellow themed rooms are control and what goes on here is so totally different than what goes on in the purple themed rooms called information but that distinction is only fluff and story around the same core mechanic that goes unchanged.\n\nspeaking of story. what trite edgy bullshit told to you by robo-waifus and husbandos. drip fed visual novel style between levels. implying everything saying nothing and then probably acting all smug at the end about how in the dark the main character was the whole time. reminds me of danganropa its certainly going to be more fun to have someone else summarize it later than to experience it yourself.",2023-02-03 08:40:39,2023-02-03 08:40:39,False,0,0,0.453474670648574829,0,True,False,False
131981710,76561198025192930,0,10,1109,0,1109,2023-02-01 13:26:20,english,"very boring. would ask for a refund but accidentally left the game running overnight. does start off in english and is just extremely dull.",2023-02-01 13:27:51,2023-02-01 13:27:51,False,0,2,0.454545468091964722,0,True,False,False
131500846,76561198024706875,306,28,410,0,410,2023-01-25 10:38:21,english,"cool game!",2023-01-25 12:28:01,2023-01-25 12:28:01,False,2,2,0.23482079803943634,1,True,False,False
131166040,76561198042673475,231,18,285,0,285,2023-01-20 05:17:49,english,"this game isn't intuitive in the slightest; i love management games but the concepts and the mechanics of this game are obfuscated to the point where it's impossible to grasp. the tutorials don't do a good job of explaining anything and after four hours of gameplay i still don't have a clue what i'm doing. i do not understand the hype around this game.",2023-01-20 05:23:03,2023-01-20 05:23:03,False,0,0,0.476190477609634399,0,True,False,False
130994771,76561198411867317,0,12,3860,0,3821,2023-03-12 16:37:10,english,"other reviews have put it better than i will but i really do not recommend this game. it presents interesting and thoughtful ideas employed masterfully in conjunction with admittedly skilled writing but mechanics of the game and the general gameplay loop almost feel pitted against the player and the idea of enjoyment. the gameplay loop encourages rather almost requires save-scumming grinding cheesing and early ng+ runs. while the lore is excellent and the idea of 'abnormalities' is unique and refreshing this game definitely feels like it wasn't tested thoroughly (if at all) and is a rough first project for pm. just play library of ruina instead lol",2023-01-17 06:37:20,2023-01-17 06:37:20,False,0,0,0.434782594442367554,0,True,False,False
130967946,76561197999162473,448,142,144,0,144,2020-11-29 17:38:52,english,"lobotomy corporation touts itself as a mix between a buisness/monster simulation and a roguelike game. this description is incredibly misleading. when you think of a simulation one would assume that there would be different aspects you control in the game but those mechanics are completely shallow. and the roguelike aspect only comes from the selection of artifacts or monsters you choose from when given the opportunity to do so.\n\nas far as the whole simulation aspect is concerned there's very little of it. you can hire employees change their equipment and decide what they do based on the department they work in. that's it. there's really no management of resources or selections of departments or tools or anything like that.\n\nas far as the game goes it's very simple each successful day completed you choose from a new abnormality (which is labeled under a serial number). then you spend the day trying to understand it by studying it while maintaining and containing all of your other abnormalities.\n\nstudying a abnormality is completely a game of guess work and can completely ruin a game until you know what's going on with it. unless you've watched play throughs and understand what they do and what they need all you can do is blindly click.\n\nafter you complete research of a abnormality it's just a matter of grinding energy and packages from them. that's it. the first couple of day(s) can be fun but the longer you play the longer you realize that's there's actually very little gameplay holding this game together. and it gets boring very quickly.\n\nfor almost $25.00 for a indie game i would have really expected a lot more based on what they actually advertise. in some instances i would actually argue their steam store page may be misleading and possibly false advertising.\n\nif you can get this game for $5.00 then fine take a chance. but at full price this game is a full blown rip off.",2023-01-16 21:54:56,2023-01-16 21:54:56,False,2,1,0.485349416732788086,0,True,False,False
